episode,name,line
07x01,Ted (2030),"Kids, if there’s one big theme to this story, and I swear, we’re totally, almost, not really all that close to the end… it’s timing. Timing is everything. For example, I never would’ve met your mother if it weren't for a wedding. The last wedding I ever thought I'd be at."
07x01,Unknown,Ted enters a room where Barney is looking at himself in the mirror.
07x01,Barney,What do you think of this tie?
07x01,Ted,"Oh, thank God. Barney Stinson needs you right before his wedding, you assume there's at least one dead hooker in the closet, right?"
07x01,Barney,Is this one better?
07x01,Ted,"Look, the tie is great, and, you know, it's perfectly normal to have some pre-wedding jitters."
07x01,Barney,"I'm not having jitters. It just occurs to me that once I put this tie on, I can never take it off. I have to wear this tie forever and ever. And sure, this tie's skinny now, but what happens if it gets fat and starts bossing me around? Did I make a mistake? Would I have been happier with the other tie? Ted, can I tell you a big secret?"
07x01,Ted,"Yeah, of course."
07x01,Barney,I'm not really talking about the tie.
07x01,Ted,"No, I got that, Barney."
07x01,Barney,I wonder if this whole thing's a disaster. What if this is the worst wedding ever?
07x01,Ted,Not possible. We've already been to the worst wedding ever.
07x01,Barney,Punchy's wedding.
07x01,Ted,Marshall really took a two-flusher on that one.
07x01,Ted (2030),The story of how Uncle Marshall ruined my friend Punchy’s wedding starts in September 2011.
07x01,Unknown,September 2011...
07x01,Ted (2030),Punchy had asked me to be his best man.
07x01,Unknown,"Barney, Robin, Marshall and Lily join Ted at McLaren's."
07x01,Everyone,Hey!
07x01,Ted,"Hey. Guys, before we go, would you mind reading my wedding toast?"
07x01,Everyone,"Oh, yeah, no problem. Sure."
07x01,Barney,If we have to.
07x01,Ted,All right.
07x01,Unknown,Ted pulls out a thick binder.
07x01,Barney,Whoa.
07x01,Ted,There’s a few different versions.
07x01,Robin,"Ted, why are you working so hard on this toast? Punchy belched his proposal through a karaoke mic at a bowling alley."
07x01,Ted,"Okay, look, I've never told you guys this, but over the years, a few of my old high school buddies have asked me to give wedding toasts, and they haven't gone great."
07x01,Unknown,Flashback
07x01,Unknown,In 2008...
07x01,Ted,Somehow those weddings all fell smack-dab in the worst moments of my life.
07x01,Ted’s toast 2008,Joel and Mora's love is a beautiful thing. I thought I had that... till my fiancée left me
07x01,Unknown,"at the altar last week. I was asked not to talk about this, so I won't. I sit outside her house at night sometimes. She got a haircut."
07x01,Ted’s toast 2009,"After I lost my job last week, uh, I was asked not to give this toast..."
07x01,Unknown,"One of the guys at the table tries to take away Ted’s mic, but Ted refuses to give it to him."
07x01,Ted’s toast continues,"No, no, no! The happy couple needs to hear this. Things end. But from the ashes of your statistically probable divorce, hope can rise anew. (sniffles) That is why I'm starting my own architecture firm--Mosbius Designs."
07x01,Unknown,Three months later…
07x01,Ted,"Mosbius Designs has failed. But Alex and Jessica's love reminds us that...That… (sobbing) Oh, God!"
07x01,Punchy,Classic Schmosby.
07x01,Unknown,End flashback
07x01,Robin,Whoa. Punchy posted the low points of your life online?
07x01,Ted,"Oh, not just that."
07x01,Unknown,Classic Shmosby Remix starts playing.
07x01,Unknown,♪ Mosbius Designs has failed ♪
07x01,Unknown,♪ But Alex and Jessica's love
07x01,Unknown,reminds us that... ♪
07x01,Unknown,♪ Tha-tha-tha-tha-tha... ♪
07x01,Unknown,"Oh, God!"
07x01,Ted,So now I seem like a total train wreck to all my old high school friends. And a bunch of people in Finland. The auto-tune thing got kind of big over there. That's why I have to nail this toast.
07x01,Barney,"Ted, you want to nail something at this wedding-- lose the Trapper Keeper. The only thing you need to bring to Cleveland is this."
07x01,Unknown,Barney shows everyone a magazine with Ted on the cover.
07x01,Ted (2030),That fall I became the youngest architect in the history of New York to break ground on a skyscraper. Which led to a glowing magazine feature. I planned on having it framed--Uncle Barney had different plans.
07x01,Barney,"Here's your toast -- ""Single file, ladies. No fatties"""""
07x01,Ted,That's ridiculous.
07x01,Barney,"Yeah, you're right. It’s Cleveland. ""Single file, ladies"""""
07x01,Unknown,Theme song starts.
07x01,Ted,I'm not going to Punchy's wedding to brag about a magazine...cover.
07x01,Robin,"Barney, he doesn't need dating advice from you. You never even called Nora."
07x01,Unknown,Flashback
07x01,Ted (2030),"Kids, you remember Nora. But just the other day..."
07x01,Barney,I'll call you.
07x01,Nora,"It's never too late, Barney."
07x01,Unknown,End flashback
07x01,Robin,Or did you call her? Not that I care. Did you? I don't care. Did you?
07x01,Barney,I haven't called her.
07x01,Robin,"Damn it, Barney. I was really, really, really rooting for you two. Who wants hot wings?"
07x01,Lily,"I’m in. Or maybe we should just pour hot sauce on Barney, since he's a total chicken."
07x01,Barney,"I did not chicken out. Nora is looking for something serious. I'm not. End of story. And yes, Robin, I would love some wings."
07x01,Lily,Cannibal.
07x01,Robin,"Okay, next round's on me."
07x01,Marshall and Lily,"Oh, no, we got it!!"
07x01,Ted (2030),Now Lily and Marshall had just found out they were having a baby.
07x01,Unknown,Flashback
07x01,Unknown,Lily and Marshall argue in their room.
07x01,Marshall,I can't wait to tell everyone.
07x01,Lily,"Baby, no, we can't tell anyone. Not until three months. I don't want to jinx it."
07x01,Marshall,"That's a bit superstitious, don't you think?"
07x01,Lily,"Whenever we board a flight, you lick the plane."
07x01,Marshall,Have we crashed even once?
07x01,Lily,Don't say a word until we know everything's okay. Deal?
07x01,Marshall,Deal. But everything's just going to be great. I promise.
07x01,Lily,How can you guarantee that?
07x01,Unknown,Marshall uncovers Lily’s belly and kisses it.
07x01,Marshall,Come here.
07x01,Unknown,End flashback
07x01,Marshall,I'm just so happy. I don't know how we're going to keep this secret for three months.
07x01,Lily,Relax. It will be easy.
07x01,Bartender,What'll you have?
07x01,Lily,"Four beers, plus one non-alcoholic."
07x01,Bartender,You're pregnant! Get in here!
07x01,Unknown,Bartender hugs Lily.
07x01,Ted (2030),And so we all headed to my hometown where we planned to celebrate Punchy's big day. Uncle Barney had different plans.
07x01,Barney,"Get ready, Cleveland. The last man to screw you this hard then disappear was LeBron James."
07x01,Robin,You're trying to get laid here?
07x01,Barney,What?
07x01,Robin,"God, Barney, tonight is a magical night between Ted's annoying friend and what's-her-face. Have some respect."
07x01,Barney,"This isn't just getting laid. This is market research. You see, my legendary"
07x01,Unknown,success rate of 83%...
07x01,Ted (to Robin),17%-- it's always the inverse.
07x01,Barney (continues),...doesn't happen by accident. Every single play I run on women has been
07x01,Unknown,"meticulously field-tested. By weeding out the bad plays in smaller markets like Cleveland, I know which ones will work in New York. For example, tonight marks the inaugural flight of the “escaped manslaughterer”. Are escaped manslaughterers sexy?"
07x01,Everyone,"No, no. Not even remotely."
07x01,Barney,Exactly. We'll never know unless I try it out tonight.
07x01,Punchy,Schmosby! Turd-faces! What's up?!
07x01,Unknown,He punches everyone’s arm jokingly.
07x01,Marshall,You really feel that ring now.
07x01,Kelly,So glad you all made it.
07x01,Punchy,"Open bar. Drink up, turd-faces, 'cause Kelly's dad's paying for all this, and he hates my guts."
07x01,Kelly,It's true.
07x01,Punchy,"Who's doing sh*ts? Come on, let's go."
07x01,Lily,"Oh, no, thank you."
07x01,Punchy,"What, are you pregnant or somethin’?"
07x01,Lily,"Let’s get hammered! (Turns to Marshall and whispers) You're drinking for two tonight, baby."
07x01,Marshall,(solemnly) I will do this for the child.
07x01,Kelly and Punchy,Go Browns!
07x01,Marshall,"In AFC regular season play, but if they mean the Super Bowl, go Vikings."
07x01,Lily,Yowza!
07x01,Unknown,Woman runs away screaming and Barney shows up at the bar.
07x01,Barney,"Escaped manslaughterers-- not sexy. Although in hindsight, that was kind of a flawed concept. Next up, “Patient Zero”."
07x01,Robin,"Lily, we are getting sloshed tonight."
07x01,Lily (to Marshall),"That's all you, baby."
07x01,Marshall,But that’ll be four sh*ts in with no food.
07x01,Lily,"In nine months, I'll be pushing a pumpkin-headed Eriksen baby out of my hoo-ha. I think Papa can manage a few extra cocktails."
07x01,Marshall,Well played.
07x01,Lily,Hakuna Matata!
07x01,Marshall,"I, uh, I gotta go get some air."
07x01,Ted (2030),"Kids, remember how I told you that Marshall ruined Punchy’s wedding? (Marshall stumbles close to the wedding cake) That wasn’t it."
07x01,Robin,"God, will you look at that guy. (High-pitched voice) I wish Barney were my boyfriend again. (Laughs) No, thanks."
07x01,Lily,Wait a minute. That’s your truth voice.
07x01,Robin,My what?
07x01,Lily,Whenever you're trying to pass something off as a joke but it's actually profoundly
07x01,Unknown,"true, you use that voice."
07x01,Unknown,Flashback
07x01,Unknown,Robin is watching TV with Lily.
07x01,Robin,(High-pitched voice) I wish the Spice Girls would get back together. They were awesome. (Laughs) The worst.
07x01,Unknown,"Everyone’s sitting at their regular McLaren’s table, and they all start complaining about a smell. It looks like someone had farted."
07x01,Robin,(High-pitched voice) That was me. I totally cut one. (Snorts) It was…that guy.
07x01,Unknown,They are all sitting on Ted’s couch.
07x01,Robin,Birthday present from my dad. (High-pitched voice) All I really want is for him to tell me that he loves me. (Snorts) Just kidding. This pen's enough. (High-pitched voice) It's not enough. (Chuckles) It's totally enough.
07x01,Lily,"Oh, my God. You still have feelings for Barney. Admit it, you still have feelings for Barney."
07x01,Unknown,End flashback
07x01,Robin,"You are drunker than I thought. I mean, look at the guy."
07x01,Barney,"Wait, wait, wait. Before you go, please answer the following survey to help me better"
07x01,Unknown,bang you in the future. What didn't work for you about this play? Did you A) not believe I was a Guinness Book world record holder? or B) did the fingernails gross you out? (Barney pulls out his extremely long fingernails from under the table.)
07x01,Man,"Can’t wait for your toast, Schmosby."
07x01,Punchy,"Yeah, here come the waterworks. (Mock sobbing)"
07x01,Ted,Wait. You're rooting for me to melt down at your own wedding?
07x01,Punchy,"Yeah, everyone is. Plus a few new friends from Finland. Good luck, Schmos. Good luck! Good luck!"
07x01,Barney,"Take it. Shows them how awesome you are. Shamelessly plug yourself, so you can shamelessly plug, let's say that."
07x01,Ted,"I told you, I'm not here to brag, okay?"
07x01,Marshall,"That's it. You’re too polite to brag. Well, fine. Let me. Because the only person"
07x01,Unknown,"on Earth who loves Ted Mosby more than Marshall Eriksen, is drunk Marshall Eriksen. So, game on."
07x01,Ted (2030),"Kids, remember how I told you Marshall ruined Punchy and Kelly’s wedding? That wasn’t it either."
07x01,Robin,Barney and I tried and failed. That was two years ago. Why would I ever go down that road again? It wouldn't even make sense.
07x01,Lily,"It doesn't have to make sense. It's chemistry. Look, I've always had a sixth sense about these things. And now that I'm pregnant... with this idea in my mind-uterus, I see things"
07x01,Unknown,even clearer. You and Barney have the kind of chemistry that just doesn't go away.
07x01,Robin,Really? That's why is he trying to LeBron anything that moves?
07x01,Barney,"Did this not work for you because A) vampires are played out, or B) claiming that I also"
07x01,Unknown,invented Facebook was kind of a hat on a hat?
07x01,Lily,You're the reason he never called Nora. You're the reason he's only test-marketing tonight. And you're the reason he keeps striking out on purpose. Chemistry.
07x01,Marshall,"Wow! Ted! Is that really you on the cover of New York magazine? Now, you say ""yes."""
07x01,Ted,"Please, stop."
07x01,Man,Schmosby. What's this about a magazine?
07x01,Ted,"You know what, Clay? It's no big deal."
07x01,Marshall,"You know what? It is a big deal. Clay, my friend Ted is designing a skyscraper, Clay. What have you been up to, Clay?"
07x01,Clay,"Well, I'm still working at the rental car company..."
07x01,Marshall,"Bravo, bravo, Clay. Any major publications want to write an article on your sweet rental car gig?"
07x01,Clay,"No, no articles. My life’s pretty dull. I guess the only news is this little gal."
07x01,Marshall,"Oh my God, wook at the wittle baby. She's so cute. All I want to do is put her little feet in my mouth. You’ve created something truly beautiful."
07x01,Clay,She is my everything.
07x01,Ted,"I mean, it's kind of a big deal... the building, you know?"
07x01,Marshall,"Hey, little one. (With another couple and their child...) So this little angel is already sleeping through the night?"
07x01,Ted,"I've had some sleepless nights...designing this building. (Baby spits directly onto the magazine, on Ted’s face.) Nothing symbolic about that."
07x01,Robin,Let it go. There is no chemistry left between me and Barney. We're done.
07x01,Lily,Oh really? Prove it. Go tell him.
07x01,Robin,Why would I go tell him that?
07x01,Lily,"Because deep down, even if he isn't aware of it himself, Barney wants to be with you. And if it's not gonna happen, he deserves to know."
07x01,Robin,"Fine. (To Barney) Barney, just so everything is crystal clear..."
07x01,Barney,I know what you're gonna say. Let's show Cleveland how it's done.
07x01,Unknown,He pulls her into his arms and takes her to the dance floor. They start doing an impromptu dance choreography.
07x01,Robin,Barney... I... (Breathless)
07x01,Unknown,Barney's phone starts ringing.
07x01,Barney,"Sorry. Oh, my God, it’s Nora. Nora’s finally calling me back."
07x01,Robin,"Wait, you said you never called her."
07x01,Barney,"I lied. I called her, like, five times. Wait, wait! You of all people know how much I suck at these things. You gotta help me. Please? Just once I would like to see what it feels like to not screw things up."
07x01,Robin,Yeah. Mmm-hmm.
07x01,Barney,"Thanks for calling me back. Um, hey, hi. The-the-the reason that, um, I called is, uh..."
07x01,Robin,To tell you how I feel about you.
07x01,Barney,...to tell you how
07x01,Unknown,I feel about you.
07x01,Robin,I know we didn't work out the first time...
07x01,Barney,I know we didn't work out the first time...
07x01,Robin,...and I know it doesn't make any sense...
07x01,Barney,...and I know it doesn't make any sense...
07x01,Robin,...but I can't shake the feeling that we belong together.
07x01,Barney,...but I can't shake this feeling that we belong together.
07x01,Robin,Is there any part of you that wants to try again?
07x01,Barney,Is there any part of you that wants to try again?
07x01,Unknown,"Barney thanks Robin silently, and she walks away."
07x01,Unknown,Marshall returns to Lily with a baby in his arms.
07x01,Marshall,"Baby, I can't take it anymore. I've gotta tell somebody that we're pregnant."
07x01,Lily,"Eriksen, stay strong. We're keeping this secret."
07x01,Marshall,There are babies everywhere. It's like a minefield of cuteness. Look at this little bastard.
07x01,Lily,"Marshall, stop it. Stay strong. You can't let holding some, some little baby... oh, with the cute little cheeks and the... the little arms and little legs... This son of a b*tch has knee dimples. Let's go tell everyone I'm pregnant."
07x01,Marshall,Yeah!
07x01,Unknown,Robin goes out on the terrace and finds Ted smoking a cigar.
07x01,Ted,You okay?
07x01,Robin,Nope. You?
07x01,Ted,Not excessively. You want to talk about it?
07x01,Robin,Not even a little.
07x01,Ted,Might make you feel better.
07x01,Robin,"Okay, fine, I'll make you a deal: you go first, and then I'll stick with my thing about not talking about it."
07x01,Ted,"Okay. All my friends from high school, they're here with their wives, their kids. Me? My date for the night is a sticky magazine."
07x01,Robin,"Sounds like high school all over again. Sorry, it was right there."
07x01,Ted,"I used to believe in destiny, you know? I'd go to the bagel place, see a pretty girl in line reading my favorite novel, whistling the song that's been stuck in my head all week and I'd think, ""Wow. Hey, maybe she's the one."" Now I think, ""I just know that b*tch is gonna take the last whole-wheat everything bagel."""
07x01,Robin,You've just been focused on work.
07x01,Ted,"No, it's more than that. I've stopped believing. Not in some depressed, ""I'm gonna cry"
07x01,Unknown,"during my toast"" way. Not in a way I even noticed until tonight. It's just, every day, I think I believe a little less and a little less and a little less. And that... sucks. What do I do about that, Scherbatsky?"
07x01,Robin,You're Ted Mosby. You start believing again.
07x01,Ted,"In what, destiny?"
07x01,Robin,"Chemistry. If you have chemistry, you only need one other thing."
07x01,Ted,What's that?
07x01,Robin,Timing. But timing's a b*tch.
07x01,Ted,"Hey, we still have our 40 deal, right? If we're both still single at 40..."
07x01,Robin,"I'm all yours. Hmm. Unrelated, do architects make big money?"
07x01,Ted,Aggressively medium money.
07x01,Robin,Damn it.
07x01,Guy,"Schmosby, you're up in two minutes."
07x01,Robin,"Okay, promise me two things: One, you start believing again, and two, don't cry"
07x01,Unknown,"during the toast, Schmosby."
07x01,Ted,I promise.
07x01,Robin,Good.
07x01,Lily,We're having a baby.
07x01,Robin,"What, for real?"
07x01,Lily,For real.
07x01,"Ted, Barney and Robin",Oh! Oh!
07x01,Voices,"Attention, everyone! It's time for the reason we're all here tonight, Schmosby's toast!"
07x01,Ted,We're here tonight to celebrate love. (People laugh) Love brings us new life...
07x01,Marshall,Hey! This isn't a meltdown. These are tears of joy. Ted is happy for his friends 'cause he's the best guy that I know. And do you know why he's happy? Because this beautiful lady right here is pregnant.
07x01,Kelly,How did you know that?! That was supposed to be a secret!
07x01,Unknown,Turns out...
07x01,Kelly,Go Browns! Go Browns! Whoo! (She pretends to drink and gives it to Punchy)
07x01,Marshall,"In AFC regular season play, but if they mean the Super Bowl, go Vikings."
07x01,Kelly’s father,"How dare you. That's my daughter, you piece of garbage."
07x01,Punchy,"You're still gonna pay for all this, right?"
07x01,Punchy’s dad,"""Piece of garbage""? That's my son."
07x01,Ted (2030),And that is how Marshall destroyed Punchy's wedding. But we didn't care. There was gonna be a sixth member of our little family.
07x01,Ted,"No wedding will ever, ever be as bad as that one, right?"
07x01,Barney,"I picked the right tie, didn't I?"
07x01,Ted,"You nailed it. And hey, just be glad it's not the ducky tie."
07x01,Ted (2030),"Ooh, the ducky tie. That's a good story kids. I'll get to that. Man, we are not even close to the end."
07x01,Barney,"You're a good best man, Ted. You're gonna cry during the toast, aren't you?"
07x01,Ted,"Oh, I'm totally gonna cry."
07x01,Barney,Come in.
07x01,Lily,"Ted, the bride wants to see you."
07x01,Ted,Okay.
07x01,Lily,Really? You're gonna go with THAT tie?
07x02,Marshall,"Oh my God, guys, I still have a hangover. Did I really ruin a marriage?"
07x02,Ted,"No, you did not ruin a marriage. Only reception."
07x02,Robin,And Miztva Bar next door.
07x02,Lily,And my dress. And your dress. You put a dress at one point.
07x02,Marshall,"Ok, you know what, it's good. I'll be a father, and I want to be the kind of man that my child can watch. Therefore, new resolution... I will never drunk! I'm serious!"
07x02,Ted (2030),"Children, this is not your Uncle Marshall was a problem with the drink. But every time he was a good resolution, we knew about that..."
07x02,Unknown,Flashback
07x02,Unknown,"The day before, Marshall returned to the apartment, drunk."
07x02,Marshall,I've done it again!
07x02,Ted (2030),But I lost a bit in the story.
07x02,Unknown,End flashback
07x02,Unknown,Barney joined the others on crutches.
07x02,Lily,What happened to your leg?
07x02,Barney,"Oh, nothing. I must have coffee with Nora. She is still angry, so I need some ""sympathy points"". She loves musicals, so I'll tell him that I fell off stage during a performance of ""Man of La Mancha."" What do you think?"
07x02,Ted,Lose the cast.
07x02,Barney,A one-man show... I love it!
07x02,Lily,Let us be clear... this woman is angry against you because you lied to him. So your solution is to claim that you broke your leg?
07x02,Barney,"You're right. A cervical neck brace! Thank you, Lil. I should have to talk to you soon. I trained all day with these crutches and one who has left in my hall is likely to need it."
07x02,Ted,"Well, I have good news. As you know, I recently decided to start out and see the girls."
07x02,Unknown,Flashback
07x02,Unknown,Ted is at the newsstand and a woman reads the magazine in which it appears.
07x02,Woman,Is this you?
07x02,Ted,"Uh, yes. Salvation. I'm Ted."
07x02,Woman,Hi.
07x02,Unknown,End flashback
07x02,Lily,"That's great, Ted."
07x02,Ted,It was a completely random moment. The kind that you can create yourself... At least I thought.
07x02,Unknown,Flashback
07x02,Unknown,Ted behind her magazine down and when a woman arrives.
07x02,Ted,"Oh, no. How have I landed on it? Salvation. Ted Mosby. (With another woman) I plead guilty. Salvation. Ted Mosby. (And another) It's embarrassing. I will be on the cover of ""An egg on my face"" magazine. But I'm not. I'm on the cover of that one. Salvation. Ted Mosby."
07x02,Unknown,End flashback
07x02,Ted,"completely random 16 times in one day, and 16 of these, 10 were single. Of these 10, seven have loved what they saw. Of these seven, four were women. And these four, two have given me their real number. And I go with both."
07x02,Unknown,Marshall's phone rings.
07x02,Marshall,"Guys, this is Garrison Cootes."
07x02,Ted (2030),"Children, Garrison Cootes was a major partner of Honeywell & Cootes. One of the largest environmental law firms in the United States.Marshall would have given anything to work there."
07x02,Marshall,"If I did not work, I could finish... in kind, a Taco Belle somewhere. And nobody wants that. Unless you want to do this, like this you would have free tacos, since you are my friends. But now I need you all calmiez! (He finally won) Hello."
07x02,Garrison,"Marshall, it's Garrison Cootes. Sorry for not having reminded you earlier but I was stuck. What's funny, because I'm literally stuck in a swamp. Well, anyway, here I am trying to collect some samples for this trial on the pollution that we are working."
07x02,Marshall,I love the work you do.
07x02,Garrison,It's a...
07x02,Marshall,"No, I mean it."
07x02,Garrison,"No, no, there is a crocodile a few meters from me. So I'll just ignore the warm urine running down my leg right now, and tell you that we are very interested in your case."
07x02,Marshall,He's interested!
07x02,Garrison,"Obviously, we need to do some sort of verification purpose, you see, an investigation of crime and a Google search, but if nothing seems wrong to us, it takes you."
07x02,Marshall,"It's fantastic, Mr Cootes!"
07x02,Garrison,"Well, I'm going. It's very funny because in fact I really have run away."
07x02,Marshall,The crocodile you saw?
07x02,Garrison,"He is coming, yes."
07x02,Unknown,GENERIC
07x02,Ted (2030),"The next night, Barney and Nora saw each other for a coffee.Fortunately, without the neck brace ridiculous."
07x02,Barney,"Hi Nora, thank you for coming."
07x02,Nora,What happened to your neck?
07x02,Barney,"My naked...? Oh, that's nothing. I was playing in a One Man Show at Fiddler. There was this scene..."
07x02,Nora,"Wow, this one has a beautiful chest."
07x02,"Barney, turning","What? Where? Oh, and shit."
07x02,Nora,Breasts...
07x02,Barney,"Wait, Nora, waiting... No, please. I'm sorry."
07x02,Nora,What is wrong with you? What kind of people need to lie like that?
07x02,Barney,"Someone who likes you, really. And suspicious, and probably accurately you do it over more later, and therefore he feels the need... I'm sorry, you spoke of this fantastic pair of tits, right? Because I seek, and I do not see them."
07x02,Unknown,Ted returned to his apartment.
07x02,Ted,"I just had two rencards following. With two adorable girls, four cappuccinos and wait... (2 minutes later...) I do not know which was the best. Here are the girls: Jessica is a student in Rhode Island, she traveled around the world, speaks four languages and plays the piano. Claire and fought for the bill. So I do not know. It is t*rture. You see, the two girls have the potential to be really special. They both deserve a second round."
07x02,Lily,Wait a minute. You're going to handle two girls at once? You do not think you should pick one before it gets too serious?
07x02,Ted,"Define ""serious""."
07x02,Lily,"Well, it's complicated. I think it would be when you have expectations, emotional involvement..."
