episode,name,line
07x18,Unknown,"You know, I actually made this mug."
07x18,Unknown,"Oh, yeah? Oh! Yeah. Oh!"
07x18,Unknown,"Yeah, sorry, coffee's a little strong."
07x18,Unknown,How was your stay with Marshall and Lily?
07x18,Unknown,Uh... a little weird.
07x18,Unknown,They're not loving Long Island.
07x18,Unknown,Oh.
07x18,Unknown,"I think deep down, they realize it just... isn't a good fit."
07x18,Unknown,It's hard to admit that sometimes.
07x18,Unknown,Sure is.
07x18,Unknown,"But I guess it's better to face it and move on than try to force something that just isn't meant to be, right?"
07x18,Unknown,I think so.
07x18,Unknown,Yeah.
07x18,Unknown,"So, what do you think you're gonna do with my old room?"
07x18,Unknown,Haven't really thought about it.
07x18,Unknown,Oh!
07x18,Unknown,Who needs Manhattan?
07x18,Unknown,Yeah.
07x18,Unknown,(phone buzzes)
07x18,Unknown,"Hmm, it's Ted. He wants to know if we want to hang out in the city."
07x18,Unknown,The next train leaves in nine minutes.
07x18,Unknown,(door closes)
07x18,Unknown,Ted
07x18,Unknown,"Dear Lily and Marshall, I don't know if you know this, but I never took your names off the lease."
07x18,Unknown,"Well, today I took my name off it."
07x18,Unknown,The apartment is now yours.
07x18,Unknown,And I think I finally figured out the best thing to do with Robin's old room.
07x18,Unknown,(soft gasp)
07x18,Unknown,"See, for me, this place has begun to feel a little haunted."
07x18,Unknown,"At first, I thought it was haunted by Robin, but now I think it was haunted by me."
07x18,Unknown,"Well, no ghost is at peace until it finally moves on."
07x18,Unknown,I need a change.
07x18,Unknown,"And I think you do, too."
07x18,Unknown,This apartment needs some new life.
07x18,Unknown,"So, please, make our old home your new home."
07x18,Unknown,It is now ghost-free.
07x18,Unknown,"Love, Ted."
07x19,Unknown,Narrator
07x19,Unknown,"Kids, in the spring of 2012, your Uncle Barney went off the grid for a couple weeks."
07x19,Unknown,So I was relieved when I got a text asking me to come over to his place.
07x19,Unknown,"Glad to hear from you, buddy."
07x19,Unknown,I was worried something bad happened...
07x19,Unknown,...to you.
07x19,Unknown,"Welcome, brother."
07x19,Unknown,What is this?
07x19,Unknown,"Ted Evelyn Mosby, you are about to be sworn to secrecy through the sacred vows of a Bro Oath, or ""Broath."""
07x19,Unknown,"Please, put on your ""brobe."""
07x19,Unknown,"Yeah, I'm not putting on the ""brobe."""
07x19,Unknown,"Ted, just... just... Okay?"
07x19,(Gregorian chant over stereo),♪ Broooo... ♪
07x19,Unknown,"Wait, are they chanting ""bro""?"
07x19,Unknown,♪ Bro... ♪
07x19,Unknown,I got some local monks to record this.
07x19,Unknown,Yeah! I got a monk guy.
07x19,Unknown,"Cool, right?"
07x19,Unknown,"It actually is, yeah."
07x19,Unknown,I'll burn it for you.
07x19,Unknown,Just remind me after The Broath.
07x19,Unknown,"Anyway, Ted Evelyn Mosby, this ritual forever binds you to keep a solemn secret..."
07x19,Unknown,Which is?
07x19,Unknown,I really like this Quinn girl!
07x19,Unknown,"I did know. You see, Quinn was a stripper... who had swindled Barney out of quite a bit of cash."
07x19,Unknown,"We're inviting everyone to dinner at Quinn's, and I want them to keep an open mind, which brings us to The Broath."
07x19,Unknown,Place your hand on The Bro Code.
07x19,Unknown,"Yeah, yeah, yeah... ""I, Ted ""Why Did I Ever Tell You My Middle Name"" Mosby..."""
07x19,Unknown,"...solemnly swear not to tell our friends that Quinn is a stripper. ""...solemnly swear not to tell our friends that Quinn is a stripper"" who duped you out of lots of money."
07x19,Unknown,"You're only supposed to repeat after me. ""You're only supposed to repeat after me."""
07x19,Unknown,Stop it.
07x19,Unknown,Stop it.
07x19,Unknown,Silence!
07x19,Unknown,"Look, I know that things started out sketchy with me and Quinn, but I really like her, so please."
07x19,Unknown,"Do you, Ted Middle-Name-Omitted Mosby, swear to uphold this Broath?"
07x19,Unknown,I do.
07x19,Unknown,Barney's dating a stripper who's gonna steal all his money!
07x19,Unknown,♪ How I Met Your Mother 7x19 ♪
07x19,Unknown,The Broath
07x19,Unknown,"Original Air Date on March 19, 2012"
07x19,Unknown,"Okay, time to go to Quinn's. Now remember, I told you nothing, okay?"
07x19,Unknown,Barney really wants us all to like her.
07x19,Unknown,But how can we?
07x19,Unknown,"Quinn totally duped Barney, and he couldn't even see it."
07x19,Unknown,"Well, apparently, the sex is mind-blowing."
07x19,Unknown,"Ha, I've been there. Yeah."
07x19,Unknown,"I was once with this chick who answered the door wearing nothing but, uh, whipped cream, a dog collar and a hot pink thong."
07x19,Unknown,Lily
07x19,,"Marshall, you can't tell sex stories about ""this chick,"" because everyone knows it's me."
07x19,Unknown,I'm the only woman you've ever been with.
07x19,Unknown,"It's not fair, the guys are always telling their sex stories and I can top every one of them."
07x19,Unknown,"Baby, you're like 20 slutty chicks all rolled into one."
07x19,Unknown,Sweet talk is not going to change my mind.
07x19,Unknown,Let's focus.
07x19,Unknown,"Tonight, we want to make sure that Quinn is not out to scam Barney."
07x19,"So, when we walk back through that door three hours from now, we should all be able to answer one simple question",Do we trust this girl?
07x19,Unknown,"Well, for one thing, she seems kind of controlling."
07x19,Unknown,"Is it okay if I put out the hummus, bunny face?"
07x19,Unknown,"No, save it for dessert."
07x19,Unknown,Idiot.
07x19,Unknown,(all laughing)
07x19,Unknown,(snaps fingers)
07x19,Unknown,"(chuckles) Uh, ah..."
07x19,Unknown,"More red wine, beauty-swan?"
07x19,Unknown,She drinks a lot.
07x19,Unknown,"Is it okay if I go pee, sugar lamb?"
07x19,Unknown,No!
07x19,Unknown,You just went three hours ago.
07x19,Unknown,"You're right, baby bear!"
07x19,Unknown,(moans)
07x19,Unknown,"Yes, so Barney's whipped; it doesn't mean that Quinn is a con artist."
07x19,Unknown,"Well, maybe we could've gotten a better read on her if two people hadn't gone off topic."
07x19,Unknown,"By the way, Quinn, your apartment is amazing."
07x19,Unknown,"Oh, yeah, it's beautiful."
07x19,Unknown,I'm actually moving out soon.
07x19,Unknown,"If you know anyone looking for a sublet, this place is rent-controlled."
07x19,Unknown,You would not believe what I pay.
07x19,Unknown,Narrator
07x19,Unknown,"Kids, things have been tense between Robin and I for weeks."
07x19,Unknown,"Ever since she moved out, and I gave the apartment to Marshall and Lily, I'd been crashing in university housing."
07x19,It's 10,"00, damn it."
07x19,Unknown,"Ned, Martin and Millie, people are trying to sleep!"
07x19,Unknown,"Hey, you were young like us once, right?"
07x19,Unknown,I was never like you guys.
07x19,Unknown,Narrator
07x19,Unknown,"And Robin was staying with her coworker, Patrice."
07x19,Unknown,"You seem so down today, Robin."
07x19,Unknown,I made you cookies.
07x19,Unknown,"Damn it, Patrice, stop smothering me!"
07x19,Unknown,Narrator
07x19,Unknown,"So, when Quinn said her apartment was available..."
07x19,ROBIN/TED,It's mine! It's mine! It's mine!
07x19,Unknown,Dibs! Dibs! Dibs!
07x19,Unknown,We got off topic? What about Marshall?
07x19,Unknown,"Hey, I was just going along with whoever suggested we play that game."
07x19,Unknown,"Hey, let's play a game!"
07x19,Unknown,"Uh, craziest sex-in-public story; I'll start."
07x19,Unknown,I was once with this chick who loved to get freaky in elevators.
07x19,Unknown,"Doors would close; suddenly, she's panting on all fours like a dog in heat."
07x19,Unknown,(panting)
07x19,Unknown,"Marshall, stop."
07x19,Unknown,I never said that it was you.
07x19,Unknown,"Okay, so anyway, last August, I go bareback with this same sl*t."
07x19,Unknown,She get's pregnant; b*tch is even hornier.
07x19,Unknown,"Oh, yeah? I was once with this dude who I caught eating a sandwich during sex."
07x19,Unknown,"Big ol' meatball falls out, lands on my back, rolls on to the elevator floor."
07x19,Unknown,"Hmm. Disgusting, right?"
07x19,Unknown,"What, I never said it was you."
07x19,Unknown,"Yeah, sorry we didn't stay as laser-focused as you guys."
07x19,Unknown,"Hey, at least I got some evidence."
07x19,Unknown,Look what I found in Quinn's bedroom.
07x19,Unknown,Barney's taking her to Hawaii.
07x19,Unknown,"Lily, you snooped through her stuff?"
07x19,Unknown,"No. It's like the first thing you see when you jimmy open her desk drawer with a letter opener her grandfather left her, according to her diary."
07x19,Unknown,Robin
07x19,,"First-class tickets, a four-star hotel--"
07x19,Unknown,this cost Barney a fortune.
07x19,Unknown,"Yeah, this proves that Quinn is totally using him for his money."
07x19,Unknown,"You know what Lily, enough."
07x19,Unknown,"Guys, even if you're right about Quinn, this is Barney."
07x19,Unknown,He'll come to his senses.
07x19,Unknown,"I give this whole thing a week, two weeks, tops."
07x19,Unknown,"And now, we have an announcement."
07x19,Unknown,Can I tell them?
07x19,Unknown,No.
07x19,Unknown,We're moving in together We're m...
07x19,Unknown,Congrats! That's great. So happy for you.
07x19,Unknown,We gotta end this.
07x19,All,Yup.
07x19,Unknown,Narrator
07x19,Unknown,"Kids, as you'll recall, our g*ng had a subtle way of letting someone know they were making a mistake."
07x19,Unknown,Where have you been?
07x19,Unknown,"Oh, worth it. Hang on."
07x19,Unknown,Hey.
07x19,Unknown,"You know we would've hated ourselves, right?"
07x19,Unknown,"So, did Robin tell you the incredibly devious thing she did today?"
07x19,Unknown,Me?!
07x19,Unknown,"Hey, so I just happened to be in the neighborhood and I thought, ""Man, Quinn is in such great shape, she must love fruit."""
07x19,Unknown,(chuckles)
07x19,Unknown,"So, unrelated, how's the search for a sub-letter going?"
07x19,Unknown,This is such a weird coincidence!
07x19,Unknown,"Robin also ""just happened"" to be in the neighborhood with a bottle of wine and her credit scores."
07x19,Unknown,(cork pops)
07x19,Unknown,I can't believe you two.
07x19,Unknown,"What do you care about more, protecting your friend from getting hurt or scoring this girl's apartment?"
07x19,Unknown,There's a working fireplace!
07x19,Unknown,Patrice is ironing my pants all wrong!
07x19,Unknown,You guys should be ashamed.
07x19,Unknown,"Speaking of shame, I was once with this chick who liked to do hand stuff underneath a jacket while we were all sitting around our favorite booth at MacLaren's."
07x19,Unknown,Gross.
07x19,Unknown,We share appetizers.
07x19,Unknown,"Okay, well, I was once with a dude who couldn't even fantasize about a three-way."
07x19,Unknown,"He was all, ""Ew, she's your best friend."""
07x19,Unknown,What now?
07x19,Unknown,I was once with a chick who wanted to get it on during a school production of
07x19,Unknown,Peter
07x19,Unknown,Pan.
07x19,Unknown,"Well, I... Wait, that wasn't me."
07x19,Unknown,"So, back to Patrice and this ironing issue..."
07x19,Unknown,I thought I was the first girl you ever did anything with.
07x19,Unknown,Anything serious.
07x19,Unknown,Please don't tell me that you're jealous of me getting to second base in tenth grade with Jenna Cristalli.
07x19,Unknown,Don't say that whore's name in front of our baby.
07x19,Unknown,What's going on?
07x19,Unknown,"Barney, this in an intervention."
07x19,Unknown,(clears throat)
07x19,Unknown,"A ""Quinntervention."""
07x19,Unknown,"You and Quinn are moving really fast, and we don't trust her."
07x19,Unknown,We're just looking out for your best interests.
07x19,Unknown,(clears throat)
07x19,Unknown,"""Quinn-terests."""
07x19,Unknown,I don't understand. Wh...
07x19,Unknown,Wait a sec.
07x19,Unknown,Ted Evelyn Mosby... you broke The Broath.
07x19,Unknown,How dare you?!
07x19,Unknown,"A Broath is the most sacred bond between-- okay, yeah, I did."
07x19,Unknown,"Are you aware that breaking a Broath can have deadly, even fatal repercussions?"
07x19,Unknown,"Have you studied history, Ted?"
07x19,Unknown,"Extensively. But I'm a little shaky on fake history, so..."
07x19,Unknown,The tragic cost of a broken Broath Uh-huh. dates back to Ancient Bro-man times...
07x19,Unknown,"Hey, Bro-tus, you'd tell me if, like, a bunch of dudes were conspiring to assassinate me, right?"
07x19,Unknown,"Um, totally, Caesar."
07x19,Unknown,Paranoid much?
07x19,Unknown,(wry chuckle)
07x19,Unknown,"Just to be sure, can you swear a Broath to me?"
07x19,Unknown,Sure. I swear.
07x19,Unknown,Thanks.
07x19,Unknown,You've always got my back.
07x19,Unknown,(clicks tongue)
07x19,Unknown,(whistling)
07x19,Unknown,(ninjas grunting)
07x19,Unknown,(grunting)
07x19,Unknown,"Et tu, Bro-te?"
07x19,Unknown,(grunts)
07x19,Unknown,(gasps and groans)
07x19,Unknown,"And then he banged, like, a hundred chicks and invented a salad."
07x19,Unknown,True story.
07x19,Unknown,"Well, Quinn lied to you; she manipulated you."
07x19,Unknown,What if she's just using you?
07x19,Unknown,She's not just using me.
07x19,Unknown,What about the expensive trip to Hawaii?
07x19,Unknown,What expensive trip to Hawaii?
07x19,Unknown,The one I got for you.
07x19,Unknown,That was supposed to be a surprise for Barney.
07x19,Unknown,He asked me to meet him here.
07x19,Unknown,"What's going on, you guys?"
07x19,Unknown,Tell her.
07x19,Unknown,"(scoffs) Fine, I'll fill her in."
07x19,Unknown,"And I am so angry, I'm not even gonna make a joke about ""filling her in."""
07x19,Unknown,"Which I did three times last night, self-five."
07x19,Unknown,"My friends think you're wrong for me, so they're having an intervention."
07x19,Unknown,(clears throat)
07x19,Unknown,"A ""Quinntervention."""
07x19,Unknown,I don't understand.
07x19,Unknown,"Well, see, your name is Quinn, and so..."
07x19,Unknown,I'll explain.
07x19,Unknown,"I made Ted promise not to tell them what you do, but he did, and now they don't trust you."
07x19,Unknown,"Wow, that really hurts."
07x19,Unknown,But what's even worse is that you felt the need to lie about me.
07x19,Unknown,"I'm not ashamed of who I am, Barney, but you clearly are."
07x19,Unknown,I'm not ashamed of you.
07x19,Unknown,I just didn't want them to judge you without...
07x19,Unknown,Maybe we are moving too fast.
07x19,Unknown,What? What is that supposed to mean?
07x19,Unknown,I don't think I can do this.
07x19,Unknown,"Wait, are you ending things just like that?"
07x19,Unknown,"If you walk out that door, you prove them right."
07x19,Unknown,You prove that you're just some heartless stripper who never gave a damn about me in the...
07x19,Unknown,Don't call me.
07x19,Unknown,(door slams)
07x19,Unknown,Wow. That was intense.
07x19,Unknown,(clears throat)
07x19,Unknown,We just destroyed what could have been a once-in-a-lifetime shot at happiness.
07x19,Unknown,"I know. I feel guilty, too."
07x19,Unknown,"Fireplace, balcony, hardwood floors..."
07x19,"Okay, I'll just say it","After everything that happened between us, I can't believe you wouldn't back down and let me have Quinn's place."
07x19,Unknown,"Ted, can I talk to you out in the hall?"
07x19,Unknown,Has it ever occurred to you that the last few weeks haven't been easy for me either?
07x19,Unknown,"In the span of one day, my engagement fell apart, I lost my best friend, then I lost my apartment."
07x19,Unknown,And-and now I'm about to lose my job.
07x19,Unknown,What do you mean?
07x19,Unknown,(sighs)
07x19,Unknown,I-I've been completely distracted at work.
07x19,And now my boss wants to see me Friday at 5,"00, which, around the office, is known as ""fire o'clock."""
07x19,Unknown,I had no idea.
07x19,Unknown,How could you?
07x19,Unknown,"The one person I want to talk to most barely looks me in the eye anymore, much less returns my calls."
07x19,Unknown,"Ted, I know it took guts to tell me you love me."
07x19,Unknown,"And I-I know how much it hurt that I didn't say it back, but..."
07x19,Unknown,"Damn it, th-this sucks for me, too."
07x19,Unknown,And I-I miss you.
07x19,Unknown,Is there any way we can just... go back to normal?
07x19,Unknown,I don't think I can do normal anymore.
07x19,Unknown,(door opens)
07x19,Unknown,Barney still isn't answering.
07x19,Unknown,We gotta go find him and apologize.
07x19,Unknown,"(knocking, door opens)"
07x19,Unknown,Oh. I thought you were Quinn.
07x19,Unknown,"Barney, we're so sorry."
07x19,Unknown,We never should've meddled like that.
07x19,Unknown,Can you forgive us? I don't know.
07x19,Unknown,You had no right to do that.
07x19,Unknown,"How can we make it up to you, buddy?"
07x19,Unknown,(Gregorian chant playing)
07x19,Unknown,"I, one of Barney's best friends..."
07x19,Unknown,Others
07x19,,"""I, one of Barney's best friends..."""
07x19,Unknown,"...promise never to interfere with his personal life again... ""...promise never to interfere with his personal life again..."""
07x19,Unknown,"...unless it's an issue of health, national security, or he's about to get up on a fattie. ""...unless it's an issue of health, national security, or he's about to get up on a fattie."""
07x19,Unknown,"And now, to seal this sacred vow, the two ladies will kiss. Barney..."
07x19,Unknown,The two ladies will kiss!
07x19,Unknown,Mmm.
07x19,Unknown,Lil...
07x19,Unknown,(chuckling)
07x19,Unknown,Okay.
07x19,Unknown,And now the gentlemen.
07x19,Unknown,Dude...
07x19,Unknown,And now the gentlemen!
07x19,Unknown,Let's just... This is silly.
07x19,Unknown,Don't-don't touch my face.
07x19,Unknown,"I was going to say, ""And now the gentlemen bump fists."""
07x19,Unknown,How long you been holding back that one?
07x19,Unknown,QUINN
07x19,,"Hot stuff, fellas."
07x19,Unknown,Did I see a little tongue in there?
07x19,Unknown,I don't understand.
07x19,Unknown,"Well, if these two will keep their sweaty paws off each other for half a second, I'll explain."
07x19,Unknown,It all started a couple days ago...
07x19,Unknown,I want you to meet my friends.
07x19,Unknown,Should I be nervous?
07x19,Unknown,Is it like bringing me home to meet your parents?
07x19,Unknown,"No, no, no."
07x19,Unknown,Much more stressful than that.
07x19,Unknown,"You see, my friends, while awesome, can be presumptuous, meddlesome and downright destructive."
07x19,Unknown,"When they learn what you do and how we met, they'll probably try to break us up."
07x19,Unknown,So let's have some fun with them.
07x19,Unknown,Mess with their heads.
07x19,Unknown,Are you saying... evil plan?
07x19,Unknown,Hells to the yes.
07x19,Unknown,"My God, you're hot."
07x19,Unknown,Wait for it.
07x19,Unknown,Here's what we do.
07x19,Unknown,Barney
07x19,Unknown,"I'll make Ted swear not to tell anyone what he knows about you, and he'll cave immediately."
07x19,Unknown,Barney's dating a stripper who's gonna steal all his money!
07x19,Unknown,"Next, we invite everyone over."
07x19,Unknown,"Is it okay if I put out the hummus, bunny face?"
07x19,Unknown,QUINN
07x19,Unknown,"No, save it for dessert, idiot."
07x19,Unknown,Barney
07x19,Unknown,Nice.
07x19,Unknown,"And, finally, we'll announce..."
07x19,Unknown,We're moving in together!
07x19,Unknown,I've got an idea.
07x19,Unknown,Let's get your friends Ted and Robin fighting over my apartment.
07x19,Unknown,"Wait, what does that have to do with you and me?"
07x19,Unknown,Nothing. I just worship chaos.
07x19,Unknown,I can't handle how hot you are right now.
07x19,Unknown,they'll try to talk me into dumping you.
07x19,Unknown,QUINN
07x19,Unknown,And I'll walk in on it.
07x19,Unknown,Barney
07x19,Unknown,Then we pretend to break up.
07x19,Unknown,"And when they crawl back, begging for forgiveness..."
07x19,Unknown,I'll be the bigger man and let them off the hook.
07x19,Unknown,QUINN
07x19,Unknown,Or make the monkeys dance for you.
07x19,Unknown,Barney
07x19,Unknown,"God, you're smart!"
07x19,Unknown,It's gonna be legen...
07x19,Unknown,I'm not waiting for it anymore. Mmm...
07x19,Unknown,...dary.
07x19,Unknown,"My God, you two are..."
07x19,Unknown,Perfect together.
07x19,Unknown,So you're not really moving in?
07x19,Unknown,"Well, it started out as a joke, but the more we talked about it..."
07x19,Unknown,The more excited we got.
07x19,Unknown,"So, yeah, we are."
07x19,Unknown,You have anything to say about that?
07x19,Unknown,So happy for you. Congratulations.
07x19,Unknown,Thank you.
07x19,Unknown,Thank you.
07x19,Unknown,"You two realize this means my apartment really is up for grabs, right?"
07x19,Unknown,I'm sure I'll find something else.
07x19,Unknown,"Me, too."
07x19,Unknown,Yeah.
07x19,Unknown,Narrator
07x19,Unknown,And that's the story of how we met Quinn.
07x19,Unknown,Ted
07x19,Unknown,"That Friday, I met Robin to see how it went at ""fire o'clock."""
07x19,Unknown,They promoted me to on-air talent.
07x19,Unknown,I'm gonna be Sandy Rivers' new co-host.
07x19,Unknown,"Oh, my God!"
07x19,Unknown,How'd that happen?
07x19,Unknown,Remember New Year's Eve?
07x19,Unknown,"When I filled in for Sandy, it turns out"
07x19,Unknown,the C.E.O. of
07x19,Unknown,World Wide News
07x19,Unknown,liked me.
07x19,Unknown,"He said I have ""moxie."""
07x19,Unknown,So he's a 1940s gangster?
07x19,(laughing),Apparently.
07x19,Unknown,"And I got a big raise, so I'm taking this apartment on Central Park West, which means..."
07x19,Unknown,Quinn's apartment.
07x19,Unknown,I already told her you'd take it.
07x19,Unknown,Wow. Thanks.
07x19,Unknown,Yeah.
07x19,Unknown,"Hey, and congrats."
07x19,Unknown,You deserve it all.
07x19,Unknown,"You know, I've been thinking about it, and..."
07x19,Unknown,I can do normal.
07x19,Unknown,To back to normal.
07x19,Unknown,To back to normal.
07x19,Unknown,(clink)
07x19,Unknown,Uh... I-I should get going. Yeah.
07x19,Unknown,You've got a lot to do. Totally.
07x19,Unknown,"So... Um, see you soon."
07x19,Unknown,See you soon.
07x19,Unknown,Yeah.
07x19,Unknown,Narrator
07x19,Unknown,We wouldn't see each other for a long time.
07x19,Unknown,But I'll get to that.
07x19,Unknown,"Listen, um... about me getting to second base in tenth grade with Jenna Cristalli..."
07x19,Unknown,I don't know what you're talking about.
07x19,Unknown,I've already forgotten about that dumb hobag.
07x19,Unknown,"Yeah, um, it didn't happen while we were watching"
07x19,Unknown,Peter Pan.
07x19,Unknown,It happened while I was playing Peter Pan.
07x19,Unknown,Here's a photo from the day I was cast.
07x19,Unknown,That's me in the middle.
07x19,Unknown,But then I had my growth spurt.
07x19,Unknown,"By opening night, I was too big for the flying harness, and, well..."
07x19,Unknown,I fell hands-first right onto Jenna Cristalli.
07x19,Unknown,The tissues in her bra saved me two broken wrists.
07x19,Unknown,"I'm sorry. I just, I just wanted to have one cool sex story that wasn't you."
07x19,Unknown,"Okay. Next time you tell it, you were in your dad's car, which you stole to go to a Metallica concert, and you got to third base with that sl*t."
07x19,Unknown,I was once with this chick... who is just the best wife ever.
07x19,Unknown,Thank you for being so cool about what I do.
07x19,Unknown,A lot of guys would be weird or jealous.
07x19,Unknown,Are you kidding?
07x19,Unknown,Who am I to judge anyone? I'm the devil!
07x19,Unknown,"I mean, if you ever wanted to stop stripping, I'd support it."
07x19,Unknown,If you wanted... to.
07x19,Unknown,Uh-huh.
07x19,Unknown,"So, you are jealous?"
07x19,Unknown,"What? No, no, not at all."
07x19,Unknown,"I'm just saying, if you ever wanted to hang up the ol' G-string, I'd completely understand."
07x19,Unknown,"Nah, I like taking my clothes off for money."
07x19,Unknown,Great.
07x19,Unknown,Let me... let me finish.
07x19,Unknown,"Hypothetically, what would make you stop?"
07x19,Unknown,Hypothetically...
07x19,Unknown,I would stop stripping if I ever got married.
07x19,Unknown,Good night.
07x19,Unknown,"And then we agreed to ""go back to normal."""
07x19,Unknown,But I'm starting to wonder if we can ever really just be friends.
07x19,Unknown,"Anyway, that's the story of me and Robin, 2005 to the present."
07x19,Unknown,What do you think?
07x19,Unknown,I think your stories are way too long.
07x19,Unknown,"I feel bad for his future kids, dude."
07x19,Unknown,"Hey, my kids are gonna love my stories."
07x19,Unknown,"They're gonna... yeah, they're gonna love my stories."
07x20,Unknown,"Chester, you're not even dressed."
07x20,Unknown,The reservation is in 15 minutes.
07x20,Unknown,Shh!
07x20,Unknown,He's back.
07x20,Every night at exactly 8,"00 p.m., the well-dressed blond man appears."
07x20,Unknown,Woman
07x20,,Chuck and Joanne are going to be waiting. You don't understand!
07x20,Unknown,"Every night, he does this."
07x20,Unknown,Every single night.
07x20,Unknown,"He steps out of this building, walks exactly seven paces, stops, and smiles."
07x20,Unknown,"Honey, I am worried about you."
07x20,Unknown,Is he trying to communicate with someone?
07x20,Unknown,Is he trying to communicate with me?
07x20,Unknown,Why is he doing this?!
07x20,Unknown,"But aside from not being able to fart in the apartment, how's living with Quinn?"
07x20,Unknown,"Oh, it's great."
07x20,Unknown,♪ How I Met Your Mother 7x20 ♪
07x20,Unknown,Trilogy Time
07x20,Unknown,"Original Air Date on April 9, 2012"
07x20,Unknown,Yep.
07x20,Unknown,Living with Quinn is great.
07x20,Unknown,"Great, great, great... great."
07x20,Unknown,So how bad is it?
07x20,Unknown,Pretty bad.
07x20,"Last night, I had just come back from my 8",00 fart.
07x20,Unknown,Sure.
07x20,Unknown,Go on.
07x20,Unknown,Still no mail.
